,name,author,link,rating,rating_count,review_count,price,pages,pages_count,text_of_reviews,age,year
0,Нейросети начало,Джейд Картер,https://www.litres.ru/book/dzheyd-karter/neyroseti-nachalo-69188950/,4.9,433,37,690.00,102 стр. 4 иллюстрации,102,"['Книга отличная. Давно хотела понять как все работает и какие возможности дают нейросети. В книге удобно и понятно все расписано. А главное сразу практическое применение, код. Теперь можно и свои сети попробовать делать.', 'Если вы хотите начать изучать нейросети, то это то, что вам нужно. Автор очень хорошо объясняет, что такое нейросеть и как она работает. Книга содержит примеры и задания, которые помогут вам углубить свои знания в этой области. Я думаю, что эта книга подойдет для всех, кто интересуется нейросетями, независимо от уровня подготовки.', 'В книге по каждой теме приводятся примеры кода, на которых подробно описан каждый шаг. Это очень удобно. Можно скопировать код и проверить его. ', 'Так же есть фишки, которые потом можно использовать и в других кодах.', 'Примеры кодов, тут их много. Новичок в теме или нет, а основы всегда должны быть под рукой. Очень удобно с электронки, скопировал код, и дальше уже меняешь под себя как надо. И для тех кто только пытается понять, тоже сразу на примерах каждый шаг. Отлично!', 'Это отличное введение в мир нейросетей для начинающих. Я научился многому о том, как работают нейроны, как они связаны в нейросетях, как обучать и применять их для различных задач, таких как классификация, регрессия и кластеризация. Автор ясно и доступно объясняют сложные концепции и методы, используя практические примеры и код. Я рекомендую эту книгу всем, кто хочет понимать, как работают нейросети и как их применять в реальной жизни.']",12+,2023
1,Python 3 и PyQt 6. Разработка приложений,Николай Прохоренок,https://www.litres.ru/book/vladimir-dronov/python-3-i-pyqt-6-razrabotka-prilozheniy-68995387/,4.7,3,1,549.00,831 стр. ,831,"['Большая книга, посвященная реализации графических приложений на языке программирования Python,', 'представлено описание с точки зрения функций и алгоритмов решения задач.']",0+,2023
3,Система взаимодействия. Коммуникации в бизнес-приложениях. Разработка в системе 1С:Предприятие 8.3 (+ epub),Е. Ю. Хрусталева,https://www.litres.ru/book/e-u-hrustaleva/sistema-vzaimodeystviya-kommunikacii-v-biznes-prilozheniyah-42078187/,4.3,10,3,250.00,130 стр. ,130,"['Полезная книга. Есть примеры оповещения пользователей о выполнении серверных процедур. Описывается механизм взаимодействия сервера и клиента', 'tel961666 достаточно важный вопрос. У меня версия конфигурации ""Управление торговлей"", в ней нет этого модуля. Вопрос: в книге написано как интегрировать в конфигурацию то чего нет? То есть, саму ""Систему взаимодействия"" в ""1С: Управление торговлей"". Я знаю, что в ""1С: Управление нашей фирмой"" это есть из коробки. Включил и пользуешься. Если в книге этого нет, то и смысла в покупке её нет.', 'Недавно моя знакомая писала статью о системе взаимодействия.', 'Система взаимодействия позволяет пользователям программ «1С:Предприятия» обмениваться текстовыми сообщениями, файлами, устраивать аудио и видеоконференции. Начиная с версии 8.3.16 есть возможность демонстрировать экран своего компьютера в ходе видеозвонка.', '', 'Поддерживаются контекстные обсуждения, связанные с конкретными объектами приложения (документами, элементами справочников, отчетами и т. п.). При этом вся переписка связана с объектом приложения и отображается вместе с ним.', '', 'С помощью Системы Взаимодействия разработчики прикладных решений могут реализовывать новые, ранее недоступные бизнес-сценарии, например, создавать чат-боты и автоматические ассистенты, облегчающие работу с приложениями, информировать пользователей о событиях, произошедших в приложении и т. п.', '', 'Система Взаимодействия доступна также в мобильном клиенте «1С:Предприятия 8».', 'Добрый день. Хотелось бы отзыв о самой книге.', 'Знания, полученные из нее позволят взглянуть на всю систему коммуникации человека и компьютера более широко. Также доступны схемы, иллюстрирующие архитектуру этого взаимодействия']",12+,2019
4,Постановка задачи обеспечения автоматизации полного цикла поддержки принятия решения,О. В. Тиханычев,https://www.litres.ru/book/o-v-tihanychev/postanovka-zadachi-obespecheniya-avtomatizacii-polnogo-cikl-67127187/,0.0,0,0,168.00,10 стр. ,10,[],0+,2021
7,Разработка и реализация портальных решений. Практикум,С. В. Маркова,https://www.litres.ru/book/pavel-lukyanov/razrabotka-i-realizaciya-portalnyh-resheniy-praktikum-57232186/,0.0,0,0,350.00,166 стр. ,166,[],0+,2020
8,"Высоконагруженные приложения. Программирование, масштабирование, поддержка (pdf+epub)",Мартин Клеппман,https://www.litres.ru/book/martin-kleppman-1733/vysokonagruzhennye-prilozheniya-programmirovanie-mass-39100996/,4.0,51,11,799.00,640 стр. ,640,"['Не могу что-либо про перевод сказать, читал данную книгу в оригинале. Очень толково и по делу описаны базы данных и интерфейсы. С другой же стороны – половину книги можно вырезать без какой либо потери в качестве и содержании…', 'Altmann Nicolas, hello world', 'Книга претендует на звание «must read» для разработчика отказоустойчивых систем. Представляет собой в первую очередь и в большей мере учебник, нежели справочник. Книга в полной мере раскрывает принципы функционирования самых разных баз данных. Но это далеко не всё, в книге описаны подходы и общие принципы к решению проблем отказов узлов в распределенных системах, выходящие за границы области баз данных. В русскоязычных сообществах книга зовется «кабанчик» и стала классикой в области разработки и проектирования распределенных отказоустойчивых решений. Отмечу высокий порог вхождения для некоторых деталей книги, в том числе B-деревья, алгоритмы консенсуса, и другие математические моменты.', 'Отличная книга, раскрывающая внутреннее устройство баз данных. Даёт понимание, в каких сценариях использовать БД того или иного класса.', '', 'Да, ее можно было бы сократить, убрав различные обороты, подводки и вопросы, на которые автор сам же и отвечает. Тем не менее, считаю, что это не критично и, более того, способствует усвоению материала', 'Книга «с кабанчиком» обязательна к прочтению — это наиболее полное руководство к построению распределённых систем с фокусом на обработку данных (коими является большинство современных web-приложений), основные проблемы, с которыми приходится сталкиваться при проектировании и варианты их решений.', 'Перевод местами хромает, но это не мешает понимать материал. Для всех переведённых терминов даётся их оригинальное название. ', 'Книга будет полезна как мидлам, которые только учатся проектировать распределённые системы, так и сеньорам, которые хотят структурировать свои знания. Для совсем джунов эта книга не подойдёт.', 'Книга стала настольной. Считаю ее необходимой практически любому разработчику или системному аналитику. Описаны все основные аспекты и лучшие практики. Рекомендую']",16+,2017
9,Становление и развитие компьютерных специальностей в Университете «Cинергия»,С. В. Харитонов,https://www.litres.ru/book/v-v-dik/stanovlenie-i-razvitie-komputernyh-specialnostey-v-universitete-ci-18739048/,0.0,0,0,168.00,3 стр. ,3,[],0+,2016
10,Применение нечетких множеств для формирования психологического портрета личности,Г. В. Тарасова,https://www.litres.ru/book/g-v-tarasova/primenenie-nechetkih-mnozhestv-dlya-formirovaniya-psihologich-5002527/,3.0,2,0,168.00,5 стр. ,5,[],0+,2010
11,Программирование на VBA в Excel. Самоучитель,Елена Яковлева,https://www.litres.ru/book/nina-komolova/programmirovanie-na-vba-v-excel-samouchitel-70980223/,5.0,1,1,549.00,512 стр. ,512,"['Что мне особенно понравилось в этой книге, так это структура подачи материала. Автор начинает с базовых понятий, не забегая вперёд, и постепенно углубляется в более сложные темы. Это делает процесс обучения плавным и не перегружает читателя информацией. Описания теории и примеры настолько понятны, что даже если раньше вы не писали код, вы легко сможете понять, о чём идёт речь.']",0+,2024
12,Разработка веб-приложений в Yii 2,Марк Сафронов,https://www.litres.ru/book/mark-safronov-7653961/razrabotka-veb-prilozheniy-v-yii-2-22880106/,3.2,10,1,519.00,394 стр. ,394,"['Жаль потраченных денег, в книге очень много ошибок, автор пропускает описание для него очевидных вещей, которые для новичков очень порой необходимы. Не советую новичкам.']",0+,2014
13,Объектно-ориентированный Python (+ epub),Дасти Филлипс,https://www.litres.ru/book/dasti-fillips/obektno-orientirovannyy-python-epub-70504741/,0.0,0,0,699.00,704 стр. ,704,[],16+,2021
14,Модели параллельного программирования,И. Е. Федотов,https://www.litres.ru/book/ilya-fedotov/modeli-parallelnogo-programmirovaniya-8341507/,0.0,0,0,450.00,385 стр. ,385,[],0+,2012
15,Грокаем машинное обучение (pdf + epub),Луис Серрано,https://www.litres.ru/book/luis-serrano-32912851/grokaem-mashinnoe-obuchenie-pdf-epub-70290604/,4.4,3,3,699.00,512 стр. ,512,"['Есть полезная информация, но многовато воды, часто излишне одно по одному. Я считаю количество страниц можно было вдвое сократить.', 'Книга охватывает довольно много алгоритмов машинного обучения, изложение очень доступное, какие-то вещи автор подаёт действительно очень просто и понятно. В целом, не пожалел что прочёл', 'Полезное издание, понятные термины и объяснения. Конечно цена высокая, но для деловой литературы это нормально. Советую к приобретению если тема машинного обучения актуальна для изучения']",16+,2021
16,Web-представительство регионального музея,Р. А. Барышев,https://www.litres.ru/book/a-s-genvald/web-predstavitelstvo-regionalnogo-muzeya-5000519/,0.0,0,0,96.00,8 стр. ,8,[],0+,2010
17,Использование оценки приближенности к узлам Wi-Fi-сети для доставки гиперлокального контента,Д. Е. Намиот,https://www.litres.ru/book/d-e-namiot/ispolzovanie-ocenki-priblizhennosti-k-uzlam-wi-fi-seti-dlya-dos-4970925/,0.0,0,0,96.00,8 стр. ,8,[],0+,2012
18,Программирование в среде ЛОГО. Первые шаги,Г. В. Белова,https://www.litres.ru/book/galina-belova/programmirovanie-v-srede-logo-pervye-shagi-8337549/,0.0,0,0,250.00,127 стр. ,127,[],0+,2010
19,Организация системы прав доступа и ее управления в проекте BlockSet,П. П. Кейно,https://www.litres.ru/book/a-u-novikov/organizaciya-sistemy-prav-dostupa-i-ee-upravleniya-v-proekte-b-43092527/,0.0,0,0,168.00,8 стр. ,8,[],0+,2019
20,Новая большая книга CSS,Дэвид Сойер Макфарланд,https://www.litres.ru/book/devid-soyer-makfarland/novaya-bolshaya-kniga-css-7065956/,4.4,27,3,550.00,720 стр. ,720,"['Это мой бестселлер!!! ', 'Хоть и называется CSS3 – автор обучает и HTML5. Я человек привыкший работать с дизайном, сразу вижу свой результат во время проектирования и из-за этого многие книги мне были скучными. Эта книга меня порадовала тем, что свой результат ты видишь сразу. Очень все просто объясняется. Подойдет как для начинающих так и для тех кто знаком с HTML5 и CSS3 потому что в книги много примеров.', 'По практической ценности материал излагаемый на страницах этой книги равноценен для меня Библий для прогеров называемое в народе', '""книга с носорогом"".', '', 'Материал объясняется доступным человеческим языком на практических задачах применимых в реальной жизни, а не только в рамках данной книги.', '', 'Фактически показано на пальцах, что и как делается к чему это приводит. Каким способом решить ту или иную задачу в процессе написания и оптимизации кода.', 'Изучать веб разработку и в особенности CSS советую по этой книге,автор также учит HTML 5.Прочитав эту книгу вы поймете многие аспекты верстки,и будете уметь верстать качественно, адаптивно и кроссбраузерно.Советую всем веб разработчикам!!!!!']",16+,2015
21,Web-сервисы Java,Тимур Машнин,https://www.litres.ru/book/timur-mashnin-30184546/web-servisy-java-5326679/,4.5,10,1,319.00,792 стр. ,792,"['В одной книге собрана практически вся нужная документация по теме. Книга конечно не для легкого чтения, на оказалась крайне полезной для практической работы.']",0+,2011
22,Грокаем функциональное мышление,Эрик Норманд,https://www.litres.ru/book/erik-normand/grokaem-funkcionalnoe-myshlenie-69434473/,5.0,1,1,799.00,608 стр. ,608,"['Книга предназначена для тех, кто хочет изучить основы функционального программирования и понять, как оно может помочь им в решении задач. Написана достаточно легко, содержит много полезной информации.']",16+,2021
23,Применение нейросетевых ассоциативных машин для обнаружения вторжений в локальную сеть,Ю. Н. Лавренков,https://www.litres.ru/book/l-g-komarcova/primenenie-neyrosetevyh-associativnyh-mashin-dlya-obnaruzhen-6320128/,0.0,0,0,96.00,14 стр. ,14,[],0+,2013
24,Практическое программирование микроконтроллеров Atmel AVR на языке ассемблера (3-е издание),Юрий Ревич,https://www.litres.ru/book/uriy-revich/prakticheskoe-programmirovanie-mikrokontrollerov-atmel-avr-na-11838168/,4.5,21,4,239.00,354 стр. ,354,"['Я не являюсь профессионалом в области программирования микроконтроллеров, но, прочитав данную книгу, уяснил для себя что такое микроконтроллеры вообще и какие механизмы обеспечивают выполнение программ. ', 'Автор хорошо объясняет функциональную структуру микроконтроллеров AVR, поясняет основные принципы программирования на языке ассемблера применительно к AVR – контроллерам, но, к сожалению, я не нашел в данной книге более интересных практических примеров, чем мигание светодиода (да простят меня истинные ценители этой книги). Хотелось бы найти что – нибудь типа программы для работы с цифровым дисплеем, сервоприводом и т.п.', 'Книга очень академична и помогает понять основы, но, для того, чтобы начать делать что – то на прикладном уровне, нужна еще как минимум одна книга с интересными практическими примерами.', 'Лучшая книга для изучения программирования AVR на ассемблере, живое изложение, читается достаточно легко, никакой воды, только полезная информация.', 'Отличное содержание. В большей части изложен опыт автора в программировании AVR. Наглядно представлены тексты програм на языке ассемблер.', 'Хорошо как учебник. Еще бы примеров, в том числе и на C. Так же, неплохо бы добавить open source инструментов под Linux-ом']",0+,2014
25,Концепция инновационного проекта «Виртуальный музей будущего». С чего начать разработку?,Е. Г. Энтина,https://www.litres.ru/book/a-m-entina/koncepciya-innovacionnogo-proekta-virtualnyy-muzey-buduschego-s-30791984/,4.0,1,0,168.00,12 стр. ,12,[],12+,2018
26,Профессиональный TypeScript. Разработка масштабируемых JavaScript-приложений (pdf + epub),Борис Черный,https://www.litres.ru/book/boris-chernyy-276503/professionalnyy-typescript-razrabotka-masshtabiruemyh-64081906/,4.9,11,4,699.00,352 стр. ,352,"['Отличная книга, для изучающих TypeScript стоит прочитать. Хорошо совмещать чтение книги с изучением тайпскрипта на практике.', 'Мне нравится стиль написания этой книги. Это отличный способ изучить машинопись и понять преимущества по сравнению со стандартным JavaScript. Мне лично очень понравились все упражнения в конце каждой главы.', 'Есть минусы ... как и все тайпскриптеры продают технологию )) Но все же книга достойная без привязки в основном к другим технологиям ака фреймворкам-библиотекам заставляющим помима изучения самого ts изучать либо ангуляр либо реакт. Не раскрыта тема декораторов и прочих сложностей ))) но для входа мне понравилась. Надо будет еще раз прочитать так как только вхожу и половину проблематики просто еще не знаю от этого не полное понимание.', 'В целом рекомендую', 'Книга полезная как для людей с опытом, так и без. Конечно, в ней есть далеко не все, но это достаточно мощный фундамент для продолжения изучения этого диалекта.']",16+,2019
28,"Введение в веб-разработку с HTML, CSS, JavaScript",Тимур Машнин,https://www.litres.ru/book/timur-mashnin-30184546/vvedenie-v-veb-razrabotku-s-html-css-javascript-70112947/,4.4,10,0,490.00,346 стр. 327 иллюстраций,346,[],12+,2023
