,name,author,link,rating,rating_count,review_count,price,pages,pages_count,text_of_reviews,age,year
594,Разработка интерфейсов прикладных программ: макетирование или прототипирование,О. В. Саяпин,https://www.litres.ru/book/i-a-bystrakova/razrabotka-interfeysov-prikladnyh-programm-maketirovanie-il-55373731/,1.4,3,2,168.00,10 стр. ,10,"['Тема не раскрыта, всего 10 страниц на такую объемную тему. Много общей информации, про разработку интерфейсов по сути ничего не узнала', 'О том, что в этой методичке 10 страниц нужно писать большими буквами в самом начале описания. Тема вообще не раскрыта. Такое чувство, что это введение к какой-то диссертации']",0+,2020
595,Обзор программных комплексов многокритериальной оптимизации,Д. С. Хабарова,https://www.litres.ru/book/d-s-habarova/obzor-programmnyh-kompleksov-mnogokriterialnoy-optimizacii-5721347/,0.0,0,0,96.00,11 стр. ,11,[],0+,2013
596,Особенности разработки современного электронно-образовательного ресурса для математических дисциплин,А. А. Лиштван,https://www.litres.ru/book/a-a-lishtvan/osobennosti-razrabotki-sovremennogo-elektronno-obrazovatelnog-30791992/,0.0,0,0,168.00,5 стр. ,5,[],0+,2018
597,Программирование на языке Pascal,Г. Г. Рапаков,https://www.litres.ru/book/georgiy-rapakov/programmirovanie-na-yazyke-pascal-643065/,4.6,22,4,111.00,473 стр. ,473,"['Данную книгу мне посоветовал мой репетитор. Сначала я относилась к ней скептически, начинаю от того, что она написана в 2004 году (а как мы знаем, мир IT не стоит на месте, следовательно, многое меняется), заканчивая тем, что считала: максимум она меня научит тому, что пишут в школьных учебниках (думала я так потому, что не долистала книгу до конца и даже до середины). Но посмотрев то, чему я смогу научиться дальше, я заинтересовалась. И именно эта книга дала мне понять, что благодаря языкам программирования можно писать не только простейшие программы, типа, калькулятора, но и оживлять изображения, и даже управлять звуком. Думаю, я ещё не раз обращусь к данной книге.', 'Самое то для тех кто хочет изучить язык программирования паскаль!!!! Все полностью доступно и понятно! Спасибо большое авторам данного учебного материала! Рекомендую полностью! Сам учитель информатики и скачал себе!!!', 'Книга замечательная, очень понравилась подача материала!\nВ начале дается экскурс в языки программирования, разобраны недостатки и сильные стороны.', 'В этой книге есть место , внимание, =) где дано практическое применение сбалансированного  дерева поиска ) Оно изпользуется в базе данных (БД) для организации индексов.', 'Вообщем учебник отличный! Много разобрано примеров задачек, также после каждой главы даны задания для закрепления материала.', 'Доходчивое, хоть и устаревшее пособие. Главный недостаток, на мой взгляд – невыразительные примеры, не покрывающие полностью главы.', '', 'Для начинающих изучать программирование.']",0+,2004
598,Ассемблер – это просто. Учимся программировать,Олег Калашников,https://www.litres.ru/book/oleg-kalashnikov/assembler-eto-prosto-uchimsya-programmirovat-648605/,4.3,26,4,143.00,330 стр. ,330,"['Читается довольно легко, предназначена для изучения «с нуля» виртуального режима 8086 процессора в ОС MS-DOS. Интересна с исторической точки зрения ) и для получения основных понятий об устройстве компьютеров и построения программ на Ассемблере.', 'Олег Калашников, автор известнейших рассылок по ассемблеру. Объяснение с самых азов, действительно, во многом является исторической ценностью. Уважение автору, его труду!', 'Хорошая книга. Все объясняется вполне доступным языком. Могу посоветовать изучать для начального уровня понимания и владения языком, но для серьезных задач скорее всего придется переходить на что-то посерьезнее.', 'Даже ознакомительный фрагмент содержит арифметические ошибки в объяснении перехода от двоичной системы исчисления в десятичную, что ожидать от оригинала.']",0+,2011
599,Создай свой VPN. Безопасное использование интернета,Джейд Картер,https://www.litres.ru/book/dzheyd-karter/sozday-svoy-vpn-bezopasnoe-ispolzovanie-interneta-70388320/,5.0,240,8,690.00,280 стр. 1 иллюстрация,280,"['Нашел в книге решение своей ошибки. В общем для этого ее и приобрел. Для новичка в этой теме подойдет. Есть полезные советы, помогают. Иногда ошибку ищешь не там…', 'В общем оказалось все проще, чем я представлял. Все можно настроить и разобраться. Главное просто начать. Не боятся ошибок, они тоже решаемы. Я одно время застрял на определенном этапе, бросил, а зря. Можно было на форумах полазить, почитать и дальше двигаться. Не стесняйтесь просить у «старших» помощи!', 'Очень своевременно нашел эту книгу. Тема  с Vpn еще долго будет актуальной. Хочу попробовать обезопасить  себя, ну хоть немного. Как в книге говорится, хотя бы в аэропорту.)', 'Казалось бы еще десять лет назад никто и думать не думал про этот vpn… Книга пригодилась, нужная тема. Безопасность хоть и мнимая.', 'Использовал книгу для того чтобы попробовать создать vpn для домашнего использования. В целом получилось, нужно еще доработать некоторые моменты. Надо учиться.']",12+,2024
600,Конфигурирование информационных и транспортных сетей в условиях неопределенности,М. И. Дли,https://www.litres.ru/book/v-v-gimarov/konfigurirovanie-informacionnyh-i-transportnyh-setey-v-usloviy-5000692/,0.0,0,0,96.00,5 стр. ,5,[],0+,2012
601,Разработка технической документации. Руководство для технических писателей и локализаторов ПО,Вадим Глаголев,https://www.litres.ru/book/vadim-glagolev/razrabotka-tehnicheskoy-dokumentacii-rukovodstvo-dlya-tehni-583215/,3.5,19,4,299.00,192 стр. ,192,"['Отличный справочник для любого руководителя, сотрудника или технического писателя, которому приходится сталкиватся с написанием или чтением технической документации. Приведены расшифровки аббревиатур, отсылка к стандартам и нормативам. Все необходимое в одной книге. Однозначно должна быть на полке у любого Российского IT специалиста.', 'Книга не впечатлила, очень сухо. Возможно, если стоит задача писать всё строго по ГОСТу, то тут она и понадобится. ', '', 'Есть некоторые недочеты в pdf файле в оглавлении, дальше по тексту вроде нормально, но читать очень скучно.', 'Книга по своей сути представляет собой очень полезный справочник по написанию технической документации – вся необходимая информация для этого собрана в одном месте. Тут и ссылки на ГОСТы, тут же и выдержки из них. Книга хорошо структурирована и очень удобна для пользования. Будет полезна как начинающим так и опытным техническим писателям, поскольку позволяет быстро найти конкретные материалы по возникающим вопросам.', 'Книга серьезно устарела, однако даёт хороший пересказ ГОСТов. Читать нужно, конспектируя, примеры достаточно специфичны, но в среднем – может бы вполне полезна на первых порах, пока нет привычки и знания всех необходимых деталей документации наизусть.', 'tomasina84, Только вот эти самые ""Госты"" стали извращением. Кто писал Госты при СССР - профессора, доктора, академики, а сейчас? - кто попало!']",0+,2008
602,"Знакомьтесь, Python. Секреты профессии",Евгений Павлов,https://www.litres.ru/book/evgeniy-pavlov-32814604/znakomtes-python-sekrety-professii-69960799/,4.0,2,2,549.00,220 стр. ,220,"['Вкратце: чтобы понять эту книгу, нужно сначала прочесть другую книгу или пройти вводный курс по Питону. К сожалению, автора очень сильно кидает из стороны в сторону - в каждой главе на читателя вываливается тонна концепций, и ни одна из них не объясняется (мне было проще, т.к. уже примерно год Питона за плечами). ', 'Приведу пример - глава ""Объектно-ориентированное программирование"". Первый абзац: закон Мура (казалось бы, причем тут закон Мура?). Второй абзац: основные отличия С++ от С такие то. Далее автор зачем то смешал в кучу основные столпы ООП (инкапсуляцию, наследование, абстракцию и полиморфизм), назвав зачем то полиморфизм наследованием, и в итоге так и не ответив на вопрос - ЧТО из себя представлет ООП и в чем его отличие от процедурного программирования. ', 'Также очень много ненужной информации - какое отношение к Питону имеет политическое устройство Нидерландов? Слегка раздражают детские словечки - вжик, бум и т.д. Ну и большое количество просто опечаток, например в названиях файлов. Чувствуется, что книга была задумана как некое вводное (не только в Питон, а вообще в дев) - но автору сильно мешают собственные профессиональные знания, которые он накидал в кучу, и которые новичку будут абсолютно непонятны. Например, зачем на данном этапе ему знать про Solid, статические анализаторы кода, отличия С от С++? ', 'Пожелания для следующего издания книги - если вводить концепцию, то давать ей определение. Одного жирного шрифта недостаточно.', 'Начало интересное! но плохо что нету вариантов и форматов для скачивания. Хотя шрифт большой и это плюс. Иллюстрации приятные! КАК ПЕРЕСТАТЬ ЧИТАТЬ И НАЧАТЬ ПРОГРАММИРОВАТЬ... - это про меня :-)']",16+,2023
603,Head First. Паттерны проектирования,Элизабет Робсон,https://www.litres.ru/book/elizabet-robson/head-first-patterny-proektirovaniya-39123671/,3.9,36,4,599.00,638 стр. ,638,"['Хорошая и качественная книга для начинающих разработчиков, которые хотели бы изучить шаблоны проектирования, но которым очень тяжело воспринимать классику от «Банды четырех». Также полезна специалистам среднего уровня для систематизации знаний и устранения возможных пробелов в таковых.', 'Хорошая книга для тех кто хочет разабраться в проектировании с нуля, через чур подробные примеры, местами даже перебор можно было бы более кратко описать', 'Хорошая книга по паттернам, в очень живой форме подается материал, много примеров и акцентов на важные моменты. Для меня как новичка в ООП просто кладезь.', 'Книга хорошая, для простых людей не для олимпиадников :-) и уровень начинающий/начально-средний. Опытным разрабам будет не очень интересно скорей всего.']",16+,2020
604,Автоматизация графического способа решения некоторых математических задач,А. В. Толок,https://www.litres.ru/book/a-v-tolok/avtomatizaciya-graficheskogo-sposoba-resheniya-nekotoryh-matemat-4970922/,0.0,0,0,168.00,7 стр. ,7,[],0+,2012
605,"Изучаем Python: программирование игр, визуализация данных, веб-приложения",Эрик Мэтиз,https://www.litres.ru/book/erik-metiz/izuchaem-python-programmirovanie-igr-vizualizaciya-dannyh-veb-p-64070132/,4.3,74,18,699.00,512 стр. ,512,"['Осторожно, под видом второго издания продается первое. ', '', 'Совпадает все, кроме обложки и одной страницы, где издательство Питер добавило ссылку на листинги программ. Все остальное, включая количество страниц, полностью идентично.', 'Алексей Копылов, я купил российское «3-е издание», а в самой книге написано что это второе (на англ.).', 'Написал издателю, объяснили это так, что оригинал переиздали (типа исправленное издание), т.к. со временем нужны были правки. А «Питер» включив эти правки назвал это вторым изданием. То есть текущее третье издание – это уже актуальное на текущий день 2-ое издание оригинала. В общем то все в порядке я считаю и сейчас (в 2021) изучая Питон по третьему изданию нет каких то несостыковок с текущей версией языка (3.9)', 'Книга супер!', '1. Половина книги – это проекты, т.е. реальные вещи, которые можно сделать, получить результат, а не академические вырожденные задачи и упражнения.', '2. Все объяснения и все теория изобилует примерами, плавно подводящими к проектам.', '3. В описании нет сложной математики и прочих компьютерных наук, что делает изучение и без того не сложного Питона легким и приятным.', 'Если ищите с чего начать – это ваш выбор.', 'Книга очень хорошая. Но и устаревшая. Придется самостоятельно копаться в Интернете, чтобы исправить все ошибки, возникающие из-за того, что код устарел за эти несколько лет.', 'Шикарная книга. Мне безумно понравилась. Выбрала Python потому, что наслышана о его универсальности и популярности. ', 'А теперь полностью о книге:', '1) Главы логично построены, нет вопросов, вроде «Эмм, а что это?».', '2) Объяснения кода очень подробно расписаны, это жирнейший плюс.', '3) Автор пишет простым языком, и каждый, я уверена, сможет разобраться.', '4) Мне очень понравились проекты в книги(Оссобенно веб-приложения), а также упражнения, после каждой главы', 'Рекомендую!', 'Очень долго ждал, но наконец вышла электронная версия 3-го издания этой полезной книги. Один из лучших самоучителей востребованного языка программирования, в новой редакции программный код усовершенствован, адаптирован под последние версии языка Python. Спасибо!', 'janezer,  она бесплатная или как']",16+,2021
606,Особенности применения информационных технологий на стадиях жизненного цикла сложных технических систем,А. Ф. Страхов,https://www.litres.ru/book/a-f-strahov/osobennosti-primeneniya-informacionnyh-tehnologiy-na-stadiyah-24869597/,5.0,1,0,168.00,8 стр. ,8,[],0+,2017
608,Самоучитель Perl,Михаил Чаунин,https://www.litres.ru/book/aleksandr-matrosov/samouchitel-perl-2930215/,5.0,5,3,79.00,432 стр. ,432,"['Очень хороший учебник для тех кто не работал с Perl. Полностью раскрывает концепцию языка. Примеры содержательны и понятны.', 'У меня есть некоторый опыт программирования, в том числе и на скриптовых языках (PHP, JavaScript), хотя назвать себя профи не могу. И вдруг стало интересно изучить Perl. Именно на этот учебник выбор пал случайно, но случай оказался счастливым.', 'В учебнике подробно описаны азы языка, даны исчерпывающие примеры и объяснения. Весьма удачен порядок подачи материала – отсылок на ещё не объяснённый материал мало, и на понимание они не влияют. Читать его удобно и приятно. Несмотря на весьма подробное объяснение, текст не перегружен, воды в нём ровно столько, чтобы не перегружать мозг терминами и понятиями.', 'Единственный минус – учебник представлен только в формате PDF, поэтому читать с 6-дюймовой электронной книги не удобно. Но, с другной стороны, это же является и плюсом, поскольку вёрстка, очевидно, издательская, а значит, опечаток в ней до неприличия мало.', 'хорошо что есть такие книги! Perl будет жить, именно замедления его развития в определенных задачах выгодно отличает его от python']",0+,2000
609,Программирование. Python. C++. Часть 1. Учебное пособие,К. Ю. Поляков,https://www.litres.ru/book/k-u-polyakov/programmirovanie-python-c-chast-1-uchebnoe-posobie-66645382/,3.6,7,2,500.00,148 стр. ,148,"['Книга необходима для самостоятельного изучения программирования, очень хорошая книга, объяснения понятны.Изучаются приёмы разработки программ, использующих компьютерную графику и анимацию.', 'Это пособие необходимо всем, кто планирует стать программистом, а пока не знает ничего. Лучшей книги я не видела: даже сложные темы объясняются очень просто и понятно. Классический С++ и популярный Python, без которого сейчас никуда.']",12+,2021
612,Информатика. Macromedia Flash MX. Компьютерная графика и анимация,М. Н. Капранова,https://www.litres.ru/book/m-n-kapranova/informatika-macromedia-flash-mx-komputernaya-grafika-i-anima-8341645/,0.0,0,0,250.00,97 стр. ,97,[],0+,2010
613,Обнаружение скрытых периодичностей методом вейвлет-анализа,М. С. Сергеев,https://www.litres.ru/book/m-s-sergeev/obnaruzhenie-skrytyh-periodichnostey-metodom-veyvlet-analiza-8350120/,0.0,0,0,96.00,6 стр. ,6,[],0+,2014
614,Фрактальный анализ поведения быстрых индикаторов экономики России,Е. С. Митяков,https://www.litres.ru/book/v-a-sazonov/fraktalnyy-analiz-povedeniya-bystryh-indikatorov-ekonomiki-ros-4971164/,3.0,2,0,96.00,4 стр. ,4,[],0+,2012
615,Обнаружение устойчивых изменений наблюдаемой сцены при пространственно-временном анализе видеопоследовательности,Л. И. Рубанов,https://www.litres.ru/book/i-b-kondratenkov/obnaruzhenie-ustoychivyh-izmeneniy-nabludaemoy-sceny-pri-5005434/,0.0,0,0,96.00,7 стр. ,7,[],0+,2010
