,name,author,link,rating,rating_count,review_count,price,pages,pages_count,text_of_reviews,age,year
850,Python. Разработка на основе тестирования,Гарри Персиваль,https://www.litres.ru/book/garri-persival-21051344/python-razrabotka-na-osnove-testirovaniya-48411143/,4.0,4,2,1049.00,624 стр. ,624,"['Ждал от книги большего. Ждал про то, как тестить бизнес-логику, про слои приложения, границы, про правильное написание быстрых изолированных тестов бизнес-логики, интеграционных тестов инфраструктуры, про команды и запросы и тд. Книга не доросла до таких тем, несмотря на свой 600-страничный размер.', 'Виды тестов и их разница даны только в последней главе. Это как? Про стабы — нет. Про запросы-команды, про зависимости и их тестирование тоже толком нет.', 'При этом зачем-то в книгу вошла белиберда про Django — про её модельки, вьюшки, урлы, миграции. Это всё в документации по фреймворку есть и очень слабо относится к теме книги — к тестированию.', 'Книга небесполезна. Но, повторюсь, ожидания мои были другими. В чём-то вероятно следующая книга Персиваля по паттернам отвечает на мои вопросы — а, может, и тоже нет.', 'Хочется прочесть дальше по теме вторую книгу Персиваля по паттернам, а также Хорикова, а также возможно Роя Ошероува.', 'По работе нужно было изучить как делается тестирование в разработке. Выбрала данную книгу. Selenium, тесты баз данных, Fabric - в ней все это есть. Имеются примеры испытания автоматизации, что нужно вводить в командную строку, небольшие кусочки кода не только на языке Python, но и на Javascript. Даже описание декоратора @property вкратце. Приведены типы тестов, чем они отличаются. Правда, данная литература для тех, кто использует фреймворк Django, про Flask там нет ничего.', 'Чиатала не целиком, а выборочно, по нужной мне теме в данный момент.', 'Объемная, добротная, информативная книга от зарубежного автора, но больше для тех, у кого уже есть опыт в программировании. Людям, кто чистый ноль, будет сложно понять о чем речь.']",0+,2017
851,Руководство по командам и shell-программированию в Linux,Денис Колисниченко,https://www.litres.ru/book/denis-kolisnichenko/rukovodstvo-po-komandam-i-shell-programmirovaniu-v-lin-5005358/,4.0,11,3,135.00,284 стр. ,284,"['Эту книгу очень удобно использовать в качестве справочника по командной строке и shell-скриптам Linux. У меня, как и у многих других, кто имеет дело с Linux, есть шпаргалки в нескольких файлах.', 'Книга может заменить большую часть таких шпаргалок. Информация излагается кратко, понятно, много примеров. На мой взгляд, материал удобно структурирован.', 'Данная книга будет весьма полезна для людей желающих более эффективно решать задачи администрирования ИТ инфраструктуры на основе Linux. Опыт автора изложенный в этой книге позволяет углубить свои знания о работе Linux систем, понять и разобраться в автоматизации выполнения рутинных задач. P.S: Спасибо Денису Колисниченко за его старания для русскоязычного сообщества Linuxойдов };о{)', 'Книга подойдёт только новичкам, скриптинг в этой книге затронут, мягко говоря, поверхностно. Он конечно молодец, что написал такую книгу, для новичка в самый раз, всё понятно расписано, без лишней воды']",0+,2011
852,Шаблоны корпоративных приложений,Мартин Фаулер,https://www.litres.ru/book/martin-fauler/shablony-korporativnyh-prilozheniy-48637483/,4.9,9,1,1800.00,546 стр. ,546,['Отличная книга от авторитетного автора Мартина Фаулера. До сих пор не потеряла актуальности и должна быть прочитана каждым программистом после получения опыта.'],0+,2003
853,Имитационная модель производственного процесса как элемент системы управления промышленным предприятием,О. Н. Алексенцева,https://www.litres.ru/book/d-v-ermoshin/imitacionnaya-model-proizvodstvennogo-processa-kak-element-si-5316336/,0.0,0,0,96.00,9 стр. ,9,[],0+,2007
854,Модульное тестирование,М. Г. Зайцев,https://www.litres.ru/book/mihail-zaycev-19031959/modulnoe-testirovanie-68891055/,0.0,0,0,157.00,109 стр. ,109,[],0+,2021
856,"Программирование на С, С++",Станислава Солнечная,https://www.litres.ru/book/stanislava-solnechnaya-24227418/programmirovanie-na-s-s-57209743/,4.0,14,3,690.00,88 стр. 64 иллюстрации,88,"['Круто написано. Четко, ясно без воды, как требует академическое образование. Написано для людей, имеющих способности к техническим дисциплинам для остальных -увы, не ваше.', 'Книга очень просто, мало информации. Кратко даны различные возможности для ознакомления, изучение их за пределами книги, так как они заслуживают тщательного и глубокого погружения.', 'Книга – сплошная боль и печаль:((( Ощущение, что ты начал смотреть сериал с середины:))))) Автор не написал ни слова об используемой в книге среде разработки, о версии используемого в книге языка С, а сразу начал приводить не имеющие общепринятые отступы тексты программ. Складывается впечатление, что научить читателя книги программировать на языке С в планы автора не входило:))))']",16+,2020
857,Нейросети. Обработка естественного языка,Джейд Картер,https://www.litres.ru/book/dzheyd-karter/neyroseti-obrabotka-estestvennogo-yazyka-69735148/,5.0,377,19,690.00,231 стр. 20 иллюстраций,231,"['Отличная серия! Обложки просто кайф. Много практики, интересные идеи для вдохновения и дальнейшего изучения. Мотивирует!', 'Книга очень содержательная. Много примеров. Отличная серия. Как только выходит покупаю. Для начинающих понятно все расписано, каждая строчка кода.', '? Нейросети для работы с текстом это прям топ тема. Очень помогают в работе. ❣️❣️❣️❣️❣️❣️❣️❣️❣️❣️❣️❣️❣️❣️❣️❣️❣️❣️❣️❣️❣️❣️❣️❣️', 'Как и остальные книги серии эта тоже полна примеров. Из-за них и покупаю. Еще конечно нравится, что объяснения есть прям почти на каждую строчку.', 'Работа с текстом самое актуальное.  Мне книга помогла разобраться в основных принципах и попробовать примеры можно. В целом было очень познавательно.']",12+,2023
858,20 простых проектов на Raspberry Pi,Сара Сантос,https://www.litres.ru/book/rui-santos-23912549/20-prostyh-proektov-na-raspberry-pi-56509820/,3.4,3,2,654.00,323 стр. ,323,"['Неплохая книга для начинающих. Примеры разнообразные, снабжены схемами и подробным описанием. Имейте ввиду, что весь код основывается на использовании библиотеки gpiozero, а не RPI.GPIO. Плюс это или минус, каждый решает сам. Список компонентов, необходимый для этой книги можно, посмотреть в оглавлении. Однозначно рекомендую к прочтению.', 'Очень хорошая, нужная книга для начинающих. Применяю её в своём кружке. Ребята в восторге!Особенно нравится всем, что можно программки (скетчи) писать на том языке, который лучше знаешь. Один минус – можно читать только онлайн.']",6+,2018
861,Особенности методологии проектирования информационных систем для малого и среднего бизнеса,Ю. В. Боковой,https://www.litres.ru/book/u-v-bokovoy/osobennosti-metodologii-proektirovaniya-informacionnyh-sistem-5615925/,0.0,0,0,168.00,9 стр. ,9,[],0+,2006
862,Построение нечетких лингвистических переменных с использованием методов кластерного анализа данных,Н. А. Дрожжин,https://www.litres.ru/book/m-i-kostenchuk/postroenie-nechetkih-lingvisticheskih-peremennyh-s-ispolzov-9464432/,5.0,2,0,168.00,8 стр. ,8,[],0+,2015
863,Архитектура компьютера,Тодд Остин,https://www.litres.ru/book/endru-tanenbaum/arhitektura-komputera-66738078/,4.2,6,3,699.00,816 стр. ,816,"['Большая, сложная, информативная книга. Рассказаны основы основ современного компьютера. не ищите в ней поверхностных знаний о актуальных вопросах, она освещает общую обстановку самого ""дна"" вычислительных машин - как работает то, о существовании чего обычный пользователь даже не догадывается. ', 'Признана как один из лучших учебников для профессионалов и специалистов. Если вы просто хотите ознакомиться с тем как работают компьютеры то лучше обойти эту книгу. Только для тех кто хочет нырнуть в ЭВМную ""бездну"".', 'Если сосредоточенно погружаться, интересно. Иногда надо себя заставлять. Но все же это серьезная литература. автор (г-н Таненбаум) весьма опытный преподаватель и методист', 'Ну что же, прочитав половину этой книги могу с уверенностью рекомендовать каждому it специалисту. Несомненно буду перечитывать её езё раз.']",16+,2015
864,Информатика. Базовый уровень. 10–11 классы. Компьютерный практикум,А. Ю. Босова,https://www.litres.ru/book/anna-bosova/informatika-bazovyy-uroven-10-11-klassy-komputernyy-praktikum-66644828/,0.0,0,0,500.00,145 стр. ,145,[],12+,2021
865,Об адекватности систем имитационного моделирования GPSS World и AnyLogic (продолжение),В. Д. Боев,https://www.litres.ru/book/vasiliy-boev/ob-adekvatnosti-sistem-imitacionnogo-modelirovaniya-gpss-worl-4991057/,1.0,1,0,96.00,11 стр. ,11,[],0+,2011
867,Карманный гайд для веб-автоматизаторов Browser Automation Studio,Павел Дуглас,https://www.litres.ru/book/pavel-duglas/karmannyy-gayd-dlya-veb-avtomatizatorov-browser-automation-st-69007012/,4.4,6,3,299.00,180 стр. 151 иллюстрация,180,"['Я считаю что у меня украли деньги. Эта книга копипаст справки программы bas. Я приобрел данную книгу ради того что бы увидеть реальный пример программы, нашел только блок-схемы программ. Все отзывы выше накручены (браво алгоритмам литреса), в тексте видно что нет конкретики. А меня заставили писать конкретнее, хотя я написал прямо очень конкретно!!!', 'Хороший гайд для начинающих, и не только программистов использующих BAS. Буду держать всегда под рукой, чтобы в случае непонимания чего-либо можно быстро посмотреть информацию.', 'Весьма полезная книга для тех, кто только начинает изучать такой весьма востребованный инструмент автоматизации веб-процессов (и не только) Browser Automation Studio. Спасибо, Павел!']",18+,2023
868,Методические приемы обучения параллельному программированию,А. Д. Шеметова,https://www.litres.ru/book/a-d-shemetova/metodicheskie-priemy-obucheniya-parallelnomu-programmirovani-23588973/,0.0,0,0,168.00,6 стр. ,6,[],0+,2016
869,SQL: Руководство по изучению языка,Крис Фиайли,https://www.litres.ru/book/kris-fiayli/sql-rukovodstvo-po-izucheniu-yazyka-434235/,3.7,33,3,279.00,454 стр. ,454,"['Прекрасная книга для начинающих (ну, в основном, для начинающих) изучать базы данных (БД) и язык обращения с ними, который называется SQL. Я давно изучаю эту тематику, но таких понятных и простых книг не встречал. Несмотря на то, что изложены только основные принципы построения БД, почерпнуть что-то для себя здесь смогут не только новички, но и достаточно матёрые в этом вопросе люди. Однако если вам нужно руководство по работе с реальными серверными СУБД или тонкости построения серьёзных БД, то это не та книга:)', 'Очень понравилась книга, давно думал заняться изучением SQL и баз данных в целом и хочу сказать в этом деле очень сильно помогла как раз она, очень подробно все расписано, так что и человеку, никогда не имевшему дела с SQL не сложно будет разобраться со всем этим. Советую', 'Хорошая книга для новичков. Начала изучать с нуля по этой книге, все легко и понятно. Немного не хватает практических заданий']",0+,2004
870,Информатика. 5–6 классы. Практикум по программированию в среде Scratch,Т. Е. Сорокина,https://www.litres.ru/book/anna-bosova/informatika-5-6-klassy-praktikum-po-programmirovaniu-v-srede-s-66644412/,4.2,5,1,550.00,146 стр. ,146,"['очень подходит для внеклассных занятий с младшими школьникам. первая ступень обучению программирования, поможет в дальнейшем лучше усвоить язык программирования высокого уровня']",6+,2021
871,Интервальный подход к оптимизации решения многокритериальной задачи о назначениях,И. В. Майорова,https://www.litres.ru/book/v-p-popov-5728238/intervalnyy-podhod-k-optimizacii-resheniya-mnogokriteria-11279478/,0.0,0,0,96.00,10 стр. ,10,[],0+,2015
873,Численно-аналитическое исследование модели экономического роста Лукаса,О. В. Мичасова,https://www.litres.ru/book/o-v-michasova/chislenno-analiticheskoe-issledovanie-modeli-ekonomicheskogo-5000752/,0.0,0,0,96.00,11 стр. ,11,[],0+,2013
874,Азбука программирования в 1С:Предприятие 8.2,Игорь Ощенко,https://www.litres.ru/book/igor-oschenko/azbuka-programmirovaniya-v-1s-predpriyatie-8-2-7063212/,4.5,2,1,167.00,272 стр. ,272,['интересно . частично вник в суть процесса . но похоже нужна еще информация для начинающих .нашел тут еще одну книженцию .'],12+,2013
875,"Саммари книги «Карьера в IT. Как найти работу, прокачать навыки и стать крутым разработчиком»",коллектив авторов,https://www.litres.ru/book/raznoe-4340152/sammari-knigi-karera-v-it-kak-nayti-rabotu-prokachat-navyki-70096408/,4.0,1,0,99.00,32 стр. 2 иллюстрации,32,[],12+,2023
877,Задачи по дискретной математике с алгоритмами на Python,С. Д. Кургалин,https://www.litres.ru/book/s-v-borzunov/zadachi-po-diskretnoy-matematike-s-algoritmami-na-python-23878157/,5.0,5,3,549.00,593 стр. ,593,"['В книге наравне с теоретическим материалом широко представлены вопросы проектирования алгоритмов решения рассматриваемых в книге задач.', 'Хороший и добротный задачник. Хотел бы иметь такой как постоянный генератор возбуждающих аудиторию от спячки задачек. Для младших курсов - само то. Для старших - может вызвать небольшое раздражение. В целом, развивает креативность в решении задач, хорошо прописан и формализм логического вывода.', 'Особенность этой книги, выделяющую ее в лучшую сторону, в том что в ней представленны как теоритический аспект в части проектирования алгоритмов, так и практический – применение алгоритмов к задачам телекоммуникации.']",12+,2022
879,Go на практике,Мэтт Фарина,https://www.litres.ru/book/mett-batcher/go-na-praktike-27072032/,4.0,45,3,639.00,376 стр. ,376,"['Книга хорошая. Купил электронную версию в дополнение к бумажной, чтобы использовать как справочник, было написано что формат pdf, при этом поиск по книге не работает, и книгу почитать можно только на этом сайте. Оценка за сервис.', 'Хорошая книга. Дает представление об основной инфраструктуре языка Go. Читается довольно легко. Все понятно. Доступны примеры для скачивания.', 'неплохое дополнение для тех кто прошел готур', 'да, есть опечатки, и особенности перевода, так например горутины называются сопрограммами, а паники – авариями)', 'читается очень легко.', 'в 2018 книжка пока что не успела устареть, возможно что с выходом второй версии языка будет не особо актуальна']",0+,2016
880,FastAPI. Веб-разработка на Python (pdf+epub),Билл Любанович,https://www.litres.ru/book/b-lubanovich/fastapi-veb-razrabotka-na-python-pdf-epub-70870316/,3.0,2,1,699.00,288 стр. ,288,"['Достаточно неплохая книга, разве что затрагивает многие важные темы очень поверхностно.', 'Только ее для работы с FastApi не хватит, но для повторения и систематизации знаний по библиотекам (Pydantic, pytest, сам fastapi) подойдет хорошо. А дальше уже документации нужных библиотек']",16+,2024
882,Справочник системного администратора по программированию Windows,И. В. Коробко,https://www.litres.ru/book/ivan-korobko/spravochnik-sistemnogo-administratora-po-programmirovaniu-win-6989002/,4.3,11,1,239.00,555 стр. ,555,"['Мне, как начинающему системному администратору, эта книга оказалась очень своевременным учебным пособием, поскольку потребности моих коллег учителей постоянно растут, и моих знаний поначалу явно не хватало, а нужно было в кратчайшие сроки устранять неполадки. Конечно, до совершенной работы далеко, но теперь не паникую по поводу самых простых и распространённых нарушений работы. Благодарность автору, администратору с большим стажем. Теперь это моя настольная книга.']",0+,2009
883,Использование трёхмерного моделирования при расследовании дорожно-транспортных происшествий,К. А. Сатюков,https://www.litres.ru/book/e-a-satukov/ispolzovanie-trehmernogo-modelirovaniya-pri-rassledovanii-doro-5019022/,2.7,3,1,168.00,6 стр. ,6,['Ничего интересного и полезного. 6 страниц фигни полной. Эта брощюра должна стоить в разы меньше. Не рекомендую к покупке'],0+,2009
884,Трёхуровневая нечеткая когнитивная модель для анализа процессов инновационного развития региона,Т. В. Какатунова,https://www.litres.ru/book/m-i-dli/trehurovnevaya-nechetkaya-kognitivnaya-model-dlya-analiza-processo-5000804/,0.0,0,0,96.00,6 стр. ,6,[],0+,2013
887,Тренинговая система дополненной реальности для авиадиспетчеров,А. Л. Горбунов,https://www.litres.ru/book/a-l-gorbunov/treningovaya-sistema-dopolnennoy-realnosti-dlya-aviadispetche-8654196/,0.0,0,0,96.00,8 стр. ,8,[],0+,2014
