,name,author,link,rating,rating_count,review_count,price,pages,pages_count,text_of_reviews,age,year
319,Pascal Next. Руководство программиста,Никита Борисович Культин,https://www.litres.ru/book/nikita-borisovich-kultin/pascal-next-rukovodstvo-programmista-69530128/,5.0,1,1,49.90,37 стр. 1 иллюстрация,37,"['Мини-справочник с примерами по Pascal Next. Брал из-за автора. Не разочарован, но сразу скажу - это именно краткое описание с примерами для тех, кто уже знаком с каким-либо языком программирования. Никаких ""погружений"" или детальных разъяснений тут нет. Это именно сборник базовой информации и примеров для тех, кто хочет быстрее разобраться с данной версией языка, а потом углубиться в документацию на сайте.', 'Учитывая супер-низкую стоимость - просто купите если планируете взаимодействовать Pascal Next - сэкономите себе время.']",0+,2023
320,Информатика. 8 класс,К. Ю. Поляков,https://www.litres.ru/book/e-eremin/informatika-8-klass-68294042/,3.0,1,0,500.00,259 стр. ,259,[],0+,2022
321,Создание микросервисов (pdf+epub),Сэм Ньюмен,https://www.litres.ru/book/sem-numen/sozdanie-mikroservisov-pdf-epub-18307468/,3.7,45,10,699.00,624 стр. ,624,"['Книга нормальная, русский перевод чудовищный. Текст переводил человек не знакомый с индустрией, отсюда «непрекращающееся развертывание», «подгоняемый шаблон сервиса» и т.д. Новичкам не советую, нужно сразу правильной терминологией пользоваться.', 'Доброго времени суток!', '', 'Книга является отличным введением в микросервисную архитектуру. Также можно использовать как справочник. Системно выстроено описание основных принципов проектирования микросервисов, процесса непрерывной интеграции и доставки (CI/CD)', 'Отличная книга с описанием принципов и методологий построения современных отказоустойчивых приложений. Не очень много практики, но это не проблема этой книги – фундаментальное описание принципов позволит ей быть актуальной пока не произойдет каких-то координальных изменений в методологии разработки', 'В книге предлагаются варианты решений вопросов связанных с взаимодействием различных систем. Это не только про микросервисы а вообще, но для микросервисов это более важно. Да кода нет, но он тут по сути и не нужен. Это не хелоуворд, а скорей справочник.', 'Лично для меня, книги O\'Reilly, это не книги, с которых надо начинать свой путь изучения чего-то нового, а книги, которые помогают систематизировать знания. Так вот, это книга еще раз подчеркивает это мнение. Почему так? Я решил начать изучать микросервисы именно с нее. И зря. Да, я в ней понял преимущества данного вида архитектуры, но временами, в ней не хватало примеров или описания ""простым языком"". Не то, что бы я не понимал о чем пишут, но слова подбирались уж более общие, вместо того, чтобы добавить небольшой пример и на нем разжевать. Только по этому поставил 4 балла.']",16+,2021
322,101 совет начинающим разработчикам в системе «1С:Предприятие 8» (+ 2epub),Е. Ю. Хрусталева,https://www.litres.ru/book/e-u-hrustaleva/101-sovet-nachinauschim-razrabotchikam-v-sisteme-1s-predpri-40932103/,5.0,13,4,250.00,214 стр. ,214,"['Если есть на свете еще советы то это инфостарт, ИТС и Хрусталева с Радченко. Вообщем покупайте любую книгу Хрусталевой и вы не пожалеете. Это ТОП литературы по 1С', 'Реально интересная и практичная книжка. Просто сборник рецептов. Держу всегда под рукой, так как есть примеры, которые реально помогли избавиться от рутинной работы.', 'На мой взгляд очень хорошая книга для начинающего, но так же может быть полезна и тем кто уже давно занимается разработкой. В книге рассмотрены не только элементарные вещи, но и даются советы по правильной разработке, что в будущем поможет сохранить не только время, но и нервы.', 'Есть много нового даже для не начинающего программиста 1С. Полезные советы, которые не освещались нигде в книгах или курсах.']",12+,2015
323,Spring Boot 2: лучшие практики для профессионалов,Фелипе Гутьеррес,https://www.litres.ru/book/felipe-guterres/spring-boot-2-luchshie-praktiki-dlya-professionalov-64070357/,4.5,8,2,699.00,464 стр. ,464,"['Для практики Spring boot отличная книга. Много всяких технологий программирования открыл для себя. Рекомендую особенно для начинающих. ', 'Как профессионал, ежедневно работающий со Spring Boot настоятельно рекомендую эту книгу всем Java разработчикам - как начинающим, так и продвинутым. Материал изложен доступно и качественно.']",16+,2020
324,Тестирование веб-API (+ epub),Марк Винтерингем,https://www.litres.ru/book/mark-vinteringem/testirovanie-veb-api-epub-70504714/,0.0,0,0,699.00,304 стр. ,304,[],16+,2022
325,Маршруты с локальными ограничениями: алгоритмы и программная реализация,И. О. Алферов,https://www.litres.ru/book/i-o-alferov/marshruty-s-lokalnymi-ogranicheniyami-algoritmy-i-programmnaya-5000782/,4.0,1,0,96.00,11 стр. ,11,[],0+,2013
326,Отзывчивый дизайн на HTML5 и CSS3 для любых устройств (pdf + epub),Бен Фрэйн,https://www.litres.ru/book/freyn/otzyvchivyy-dizayn-na-html5-i-css3-dlya-lubyh-ustroystv-pdf-epub-67195015/,4.8,14,2,499.00,336 стр. ,336,"['Очень своевременно приобрёл данную книгу. Выбор между специализированной по CSS и ею без сомнений оказался верным. И дело даже не в том, что понравился избирательный подход к новейшим возможностям современного HTML и CSS, представленным автором, но и то, как он увязал их на примере своего сайта, здесь же представленного, совместив его с огромным количеством предложенного инструментария, полезного при его реализации, а также параллельно ознакомив с большим количеством стандартов и инструкций W3C, для этого необходимых, создав тем самым целостную картину профессионального подхода к изложенному материалу.', 'Интересная книга, подойдет для новичков. Сложные вещи рассказываются простым языком. Приятно читать. Я немного знаю html и хотела разобраться со стилями, гридами и другими современными штучками. Я не специалист, но все понимаю.']",16+,2020
327,Информатика. Подготовка к ЕГЭ в 2014 году. Диагностические работы,М. А. Ройтберг,https://www.litres.ru/book/m-a-roytberg/informatika-podgotovka-k-ege-v-2014-godu-diagnosticheskie-rab-6133094/,0.0,0,2,60.00,176 стр. ,176,"['Шесть вариантов работ для частей 1 и 2, три варианта для части 3. Подробные ответы и критерии оценивания. ', 'Книга написана в рамках проекта «Статград». СтатГрад – это всероссийский Интернет-проект, созданный для того, чтобы помочь каждому образовательному учреждению качественными дидактическими и методическими материалами. ', 'Один из авторов – доктор физико-математических наук, заведующий лабораторией прикладной математики Института математических проблем биологии РАН, доцент Высшей школы экономики. Другой – доцент кафедры прикладной математики Университета города Переславля, автор нескольких учебников по информатике. Оба вместе – замечательный сплав опыта, науки и практики.', 'С удовольствием использовала эту брошюру для подготовки учащихся к экзамену. Задания, приведенные в брошюре вполне адекватны требованиям экзамена и соответствуют демо-версии.']",0+,2014
330,Построение семантически связанных информационных объектов текста,И. С. Лебедев,https://www.litres.ru/book/i-s-lebedev/postroenie-semanticheski-svyazannyh-informacionnyh-obektov-tek-5316238/,0.0,0,0,168.00,8 стр. ,8,[],0+,2007
331,HTML 4.0,Александр Матросов,https://www.litres.ru/book/aleksandr-matrosov/html-4-0-2976735/,5.0,4,1,183.00,672 стр. ,672,['Отличная книга! Имею у себя такую. Для обучения по программированию отличная! Единственный минус – она уже устарела. Но тем кто хочет изучить Web 1.0 – идеальна'],0+,2008
332,Динамическое моделирование процессов развития пенсионной системы,Ю. А. Морозова,https://www.litres.ru/book/n-n-lychkina/dinamicheskoe-modelirovanie-processov-razvitiya-pensionnoy-si-6088152/,0.0,0,0,168.00,12 стр. ,12,[],0+,2013
334,Имитационная модель «хакер-администратор»,О. С. Бондаренко,https://www.litres.ru/book/e-a-malinovskaya/imitacionnaya-model-haker-administrator-5002530/,0.0,0,0,96.00,2 стр. ,2,[],0+,2010
335,Java. Решение практических задач,Анджел Леонард,https://www.litres.ru/book/andzhel-leonard/java-reshenie-prakticheskih-zadach-67727274/,4.3,7,3,449.00,720 стр. ,720,"['Думаю в книге приведены хорошие примеры для оттачивания навыков программирования.Мне книга понравилось.Покупкой доволен.', 'Поначалу взял ее для освоения Java, так сказать с нуля. Но потом убедился, что ее лучше использовать имея понимание основ. Но как практичный справочник решения задач, решения в современном стиле и подходе, очень даже хорошая книга.', 'Перевод, конечно, оставляет желать лучшего. Пояснения к решению сухое. Хотелось бы детального разбора задач. Но цена позволяет не жалеть о потраченных деньгах))']",0+,2019
336,Знакомство с Python (+ epub),Дэвид Эймос,https://www.litres.ru/book/dzhoanna-yablonski/znakomstvo-s-python-epub-68677476/,4.8,8,4,599.00,512 стр. ,512,"['Отличная книга с понятным и доступным изложением. Тут действует принцип - читай и применяй. Вы поймете как преобразовать, визуализировать данные, как при помощи этих данных разобраться в ситуации, получить ответы на вопросы, построить статистические модели.', 'Своевременно выпущена эта книга. Курсы по теме программирования стоят столько, что кредит придется платить  целый год. Книга лучше курсов.', 'Елена Гаранина есть и бесплатные, отлично дополняющие книгу. Поколение Python на Stepik и/или хэндбук по Python в Академии Яндекса.', 'Не рекомендую тем, кто, как и я, начинает изучение программирования с 0. Поначалу, действительно всё понятно, упражнения простые. Однако как только идёт минимальное усложнение материала – сразу начинаются проблемы. Всё примеры в книги примитивные, нет сложных по которым ты мог бы ориентироваться. А вот в упражнениях встречаются усложнения, которые не воспроизводятся в примерах. Например, нас просят написать функцию в цикле, но при этом нет ни одного наглядного примера как это в принципе выглядит. Другой пример, в теории мы видим код только с числовыми переменными, а упражнения даются со строковыми переменными, которые к тому же ещё задействованы пользовательским вводом. Или, все примеры только с одной неизвестной, а в упражнении нам усложняют до двух неизвестных переменных. Как быть? Но самый большой минус – это отсутствие ответов на задания. Ссылки, которые даются в книге отправляют тебя на англоязычный сайт, где просто книга на английском и платные видео. В общем, потратил я на эту книгу около 30 часов и изучил 170 страниц. Самые простое я усвоил, однако дальше оказалось слишком трудно. Буду изучать «питон» по видеоурокам.', 'Я не питонщик по основной своей деятельности, но писал пару проектов на нём. Решил взяться вот за него основательно, щас будет от меня дофига рецензий на книжки по теме. Учу до уровня сеньора, так что, книг будет много.', 'В общем, что хочу сказать - это отличный учебник для полного новичка. Я, конечно, проетел по нему ветром, что-то вспомнил как делается, что-то просто закрепил, но в основном я всё знаю. В конце обзорчики на разные ходовые библиотеки. Учтите, что код для PyPDF уже deprecated - если будете ставить - ставьте ту версию, которая в учебнике. Но это лишь царапание поверхности всё равно, так что ничего страшного.']",16+,2022
337,Имитационное моделирование с использованием системно-объектного подхода,А. Г. Жихарев,https://www.litres.ru/book/a-g-zhiharev/imitacionnoe-modelirovanie-s-ispolzovaniem-sistemno-obektnogo-17085770/,0.0,0,0,168.00,14 стр. ,14,[],0+,2015
339,Алгоритм синтеза 2D-объектов по 1D-объектам для вертикальных геологических разрезов в геоинформационной системе (ГИС),Н. А. Тюкачев,https://www.litres.ru/book/n-a-tukachev/algoritm-sinteza-2d-obektov-po-1d-obektam-dlya-vertikalnyh-ge-4998220/,0.0,0,0,168.00,5 стр. ,5,[],0+,2010
340,HTML5 и CSS3. Веб-разработка по стандартам нового поколения,Брайан П. Хоган,https://www.litres.ru/book/brayan-p-hogan/html5-i-css3-veb-razrabotka-po-standartam-novogo-pokoleniya-11643814/,4.0,27,2,249.00,320 стр. ,320,"['Отличная доступная цена для профи. Новичку ловить в книге нечего, она не для начинающих. Для профи и «глубокопонимающих» одна из лучших книг на рынке. Если у вас нет опыта в верстке и проектировании сайтов, смысла в книге нет, кроме разочарования ничего не получите.', 'Эта книга только для людей уже знающих языки программирования. Для новичка это будет неподъёмным материалом. Поэтому выбирайте сами. А цена достойна.', 'Den070802, ￼html и css не являются языками программирования. Уместнее было бы сказать что она подойдёт как справочник при изучение web-вёрстки.']",0+,2013
341,Опыт разработки и тестирования встраиваемой микроядерной операционной системы,В. А. Сартаков,https://www.litres.ru/book/v-a-sartakov/opyt-razrabotki-i-testirovaniya-vstraivaemoy-mikroyadernoy-op-4977171/,0.0,0,0,96.00,5 стр. ,5,[],0+,2011
343,Обработка и визуализация пространственных данных на гибридном вычислительном кластере,А. С. Черкашин,https://www.litres.ru/book/a-s-cherkashin/obrabotka-i-vizualizaciya-prostranstvennyh-dannyh-na-gibrid-8350074/,0.0,0,0,96.00,11 стр. ,11,[],0+,2014
344,Bacterial optimization and complex swarm-simulation modeling of innovative projects’ promotion into the regions,O. Bulygina,https://www.litres.ru/book/o-bulygina/bacterial-optimization-and-complex-swarm-simulation-modeling-of-36629950/,0.0,0,0,168.00,8 стр. ,8,[],0+,2018
345,React 17. Разработка веб-приложений на JavaScript,Владимир Дронов,https://www.litres.ru/book/vladimir-dronov/react-17-razrabotka-veb-prilozheniy-na-javascript-68998897/,3.0,2,1,549.00,384 стр. ,384,"['Честно говоря книга понравилась,достаточно подробно и грамотно описан не только react но и популярные библиотеки которые используются вместе с ним.К сожалению порог входа показался мне слегка завышенным, зачастую пришлось перечитывать абзац несколько раз чтобы все точно понять. Но это все равно отличный способ выучить react и затем двигатся дальше.']",12+,2022
346,С#. Основы программирования,Светлин Наков,https://www.litres.ru/book/svetlin-nakov/s-osnovy-programmirovaniya-70881667/,0.0,0,0,529.00,498 стр. ,498,[],16+,2019
348,"Математические модели, алгоритмы и комплекс программ для анализа и прогнозирования показателей национальной безопасности",Д. В. Кондратов,https://www.litres.ru/book/d-v-kondratov/matematicheskie-modeli-algoritmy-i-kompleks-programm-dlya-an-55372813/,0.0,0,0,168.00,18 стр. ,18,[],0+,2020
349,IT Компас: как правильно программировать IT-карьеру,Илья Кырчумару,https://www.litres.ru/book/ilya-kyrchumaru/it-kompas-kak-pravilno-programmirovat-it-kareru-70900405/,5.0,3,1,490.00,205 стр. 9 иллюстраций,205,"['Эта книга не об IT-карьере, а о наборе качеств нужном для такой карьеры. Помимо блестящего знания предмета автор обладает неплохим чувством юмора, что делает книгу умной, полезной и увлекательной.', 'И.Смирнов, д.ф.н, член-корреспондент РАО', 'autoreg1174403998, спасибо за добрые слова! Надеюсь, что вы имели ввиду, что это книга не только об IT-карьере, но ещё и соответствующих качествах ;)']",0+,2024
350,Моделирование параметров конкурентоспособного товара в условиях монополистической конкуренции предприятий,Л. В. Степанов,https://www.litres.ru/book/l-v-stepanov/modelirovanie-parametrov-konkurentosposobnogo-tovara-v-uslovi-4995534/,0.0,0,0,96.00,8 стр. ,8,[],0+,2011
